{
  "$schema": "http://json-schema.org/draft-07/schema#",
  "type": "object",
  "properties": {
    "id": { "type": "string" },
    "title": { "type": "string" },
    "date": { "type": "string", "format": "date" },
    "start": { "type": "string" },
    "end": { "type": "string" },
    "venueId": { "type": "string" },
    "type": { "type": "string" },
    "performerRefs": {
      "type": "array",
      "items": { "type": "string" }
    }
  }
}