
            {
                "id": "e033",
                "title": "Velvet Static Session",
                "date": "2026-07-25",
                "start": "16:00",
                "end": "17:00",
                "venueId": "v2",
                "type": "Performance",
                "performerRefs": [
                    
                        "p033"
                ]
            }
        