
            {
                "id": "e049",
                "title": "Basement Voyager",
                "date": "2026-07-26",
                "start": "22:00",
                "end": "23:00",
                "venueId": "v1",
                "type": "Performance",
                "performerRefs": [
                    
                        "p049"
                ]
            }
        