
            {
                "id": "e034",
                "title": "Arcade Bassline",
                "date": "2026-07-25",
                "start": "17:00",
                "end": "18:00",
                "venueId": "v2",
                "type": "Performance",
                "performerRefs": [
                    
                        "p034"
                ]
            }
        