
            {
                "id": "e014",
                "title": "Bass Tunnel",
                "date": "2026-07-24",
                "start": "17:00",
                "end": "18:00",
                "venueId": "v2",
                "type": "Performance",
                "performerRefs": [
                    
                        "p014"
                ]
            }
        