
            {
                "id": "e037",
                "title": "Tramline Rush",
                "date": "2026-07-25",
                "start": "20:00",
                "end": "21:00",
                "venueId": "v2",
                "type": "Performance",
                "performerRefs": [
                    
                        "p037"
                ]
            }
        