
            {
                "id": "e039",
                "title": "Nomad Night",
                "date": "2026-07-25",
                "start": "22:00",
                "end": "23:00",
                "venueId": "v2",
                "type": "Performance",
                "performerRefs": [
                    
                        "p039"
                ]
            }
        