
            {
                "id": "e022",
                "title": "Thunder Bloom",
                "date": "2026-07-25",
                "start": "15:00",
                "end": "16:00",
                "venueId": "v1",
                "type": "Performance",
                "performerRefs": [
                    
                        "p022"
                ]
            }
        