
            {
                "id": "e026",
                "title": "Prism Ascend",
                "date": "2026-07-25",
                "start": "19:00",
                "end": "20:00",
                "venueId": "v1",
                "type": "Performance",
                "performerRefs": [
                    
                        "p026"
                ]
            }
        