
            {
                "id": "e051",
                "title": "Neon Day 3 Warmup",
                "date": "2026-07-26",
                "start": "14:00",
                "end": "15:00",
                "venueId": "v2",
                "type": "Performance",
                "performerRefs": [
                    
                        "p051"
                ]
            }
        