
            {
                "id": "e050",
                "title": "Final Mainstage Closing",
                "date": "2026-07-26",
                "start": "23:00",
                "end": "00:00",
                "venueId": "v1",
                "type": "Performance",
                "performerRefs": [
                    
                        "p050"
                ]
            }
        