
            {
                "id": "e032",
                "title": "Blue Vault",
                "date": "2026-07-25",
                "start": "15:00",
                "end": "16:00",
                "venueId": "v2",
                "type": "Performance",
                "performerRefs": [
                    
                        "p032"
                ]
            }
        