
            {
                "id": "e053",
                "title": "Neon Monarch",
                "date": "2026-07-26",
                "start": "16:00",
                "end": "17:00",
                "venueId": "v2",
                "type": "Performance",
                "performerRefs": [
                    
                        "p053"
                ]
            }
        