
            {
                "id": "e057",
                "title": "Amber Skyline",
                "date": "2026-07-26",
                "start": "20:00",
                "end": "21:00",
                "venueId": "v2",
                "type": "Performance",
                "performerRefs": [
                    
                        "p057"
                ]
            }
        