
            {
                "id": "e018",
                "title": "Pulse Workshop",
                "date": "2026-07-24",
                "start": "21:00",
                "end": "22:00",
                "venueId": "v2",
                "type": "Performance",
                "performerRefs": [
                    
                        "p018"
                ]
            }
        