
            {
                "id": "e038",
                "title": "Shadow Carousel",
                "date": "2026-07-25",
                "start": "21:00",
                "end": "22:00",
                "venueId": "v2",
                "type": "Performance",
                "performerRefs": [
                    
                        "p038"
                ]
            }
        