
            {
                "id": "e013",
                "title": "Laser Alley",
                "date": "2026-07-24",
                "start": "16:00",
                "end": "17:00",
                "venueId": "v2",
                "type": "Performance",
                "performerRefs": [
                    
                        "p013"
                ]
            }
        