
            {
                "id": "e035",
                "title": "Orbit Live",
                "date": "2026-07-25",
                "start": "18:00",
                "end": "19:00",
                "venueId": "v2",
                "type": "Performance",
                "performerRefs": [
                    
                        "p035"
                ]
            }
        