
            {
                "id": "e047",
                "title": "Violet Overdrive",
                "date": "2026-07-26",
                "start": "20:00",
                "end": "21:00",
                "venueId": "v1",
                "type": "Performance",
                "performerRefs": [
                    
                        "p047"
                ]
            }
        