
            {
                "id": "e055",
                "title": "Hardwave Oracle",
                "date": "2026-07-26",
                "start": "18:00",
                "end": "19:00",
                "venueId": "v2",
                "type": "Performance",
                "performerRefs": [
                    
                        "p055"
                ]
            }
        